{
  "$schema": "http://json-schema.org/draft-07/schema#",
  "title": "Meetups",
  "description": "Schema for meetups data in the 757 Community site",
  "type": "array",
  "items": {
    "type": "object",
    "required": ["name", "url", "tags", "category", "metadata"],
    "properties": {
      "name": {
        "type": "string",
        "description": "The name of the meetup"
      },
      "url": {
        "type": "string",
        "pattern": "^https?://[^\\s/$.?#].[^\\s]*$",
        "description": "The URL to the meetup's website or page"
      },
      "tags": {
        "type": "array",
        "items": {
          "type": "string"
        },
        "minItems": 1,
        "description": "An array of tags that describe the meetup"
      },
      "category": {
        "type": "string",
        "enum": ["Development", "Technology", "Design", "Cloud"],
        "description": "The category of the meetup"
      },
      "rssFeed": {
        "type": "string",
        "pattern": "^https?://[^\\s/$.?#].[^\\s]*$",
        "description": "The RSS feed URL for the meetup's events"
      },
      "slug": {
        "type": "string",
        "pattern": "^[a-z0-9]+(?:-[a-z0-9]+)*$",
        "description": "Stable URL slug for this group's page. Stored explicitly rather than derived from the name so a group renaming itself does not silently break its URL."
      },
      "description": {
        "type": "string",
        "minLength": 50,
        "description": "Hand-written description of the group: what it is and who it is for. Distinct from metadata.description, which is a scraped Open Graph blurb truncated mid-sentence and should not be rendered as page copy."
      },
      "city": {
        "type": "string",
        "description": "Primary city the group meets in, e.g. 'Norfolk'"
      },
      "cadence": {
        "type": "string",
        "description": "Human-readable meeting cadence, e.g. '2nd Tuesday, monthly'"
      },
      "status": {
        "type": "string",
        "enum": ["active", "inactive"],
        "description": "Whether the group is currently holding events. Omitted means active."
      },
      "metadata": {
        "type": "object",
        "required": ["imageUrl"],
        "properties": {
          "imageUrl": {
            "type": "string",
            "pattern": "^/images/.*$",
            "description": "URL to the meetup's cover image (must be a relative path starting with /images/)"
          },
          "title": {
            "type": "string",
            "description": "The title of the meetup from metadata"
          },
          "description": {
            "type": "string",
            "description": "The description of the meetup from metadata"
          }
        },
        "additionalProperties": false
      }
    },
    "additionalProperties": false
  }
} 