[
  {
    "name": "AI Collective Hampton Roads",
    "url": "https://www.meetup.com/757-artificial-intelligence",
    "tags": [
      "AI",
      "Artificial Intelligence",
      "Open Source",
      "Cloud Computing"
    ],
    "category": "Technology",
    "rssFeed": "https://www.meetup.com/757-artificial-intelligence/events/rss/",
    "metadata": {
      "imageUrl": "/images/meetups/meetup-com-757-artificial-intelligence.jpg",
      "title": "The AI Collective Hampton Roads | Meetup",
      "description": "The AI Collective is a non-profit, grassroots community uniting 200,000+ pioneers – founders, researchers, operators, and investors – exploring the frontier of AI in major tech hubs worldwide. Through events, workshops, and community-led research, we empower the AI ecosystem to collaboratively steer"
    }
  },
  {
    "name": "757 Developers",
    "url": "https://www.meetup.com/757dev/",
    "tags": [
      "General"
    ],
    "category": "Development",
    "rssFeed": "https://www.meetup.com/757dev/events/rss/",
    "metadata": {
      "imageUrl": "/images/meetups/meetup-com-757dev.jpg",
      "title": "757 Developers | Meetup",
      "description": "The 757 area has a ton of great developer groups that make up the greater developer community. &amp;nbsp;Our goal is to promote events (no matter what the size) that don&#x27;t have a good fit within another area group.If you are interested in a meetup idea, but don&#x27;t want to invest in Meetup fees -- post yo"
    }
  },
  {
    "name": "757 Python Users Group",
    "url": "https://www.meetup.com/757-python-users-group/",
    "tags": [
      "Python",
      "Programming"
    ],
    "category": "Development",
    "rssFeed": "https://www.meetup.com/757-python-users-group/events/rss/",
    "metadata": {
      "imageUrl": "/images/meetups/meetup-com-757-python-users-group.jpg",
      "title": "Virginia Python Users Group | Meetup",
      "description": "Welcome to the Virginia Python Software meetup, we have expanded the original Norfolk group to now include the entire Commonwealth. This group is for anyone interested in all aspects of the Python programming language. Whether you use Python professionally, as a hobbyist, or just looking for a new l"
    }
  },
  {
    "name": "757ColorCoded",
    "url": "https://www.meetup.com/757colorcoded/",
    "tags": [
      "DEI",
      "General",
      "Learning"
    ],
    "category": "Development",
    "rssFeed": "https://www.meetup.com/757colorcoded/events/rss/",
    "metadata": {
      "imageUrl": "/images/meetups/meetup-com-757colorcoded.jpg",
      "title": "757ColorCoded Meetup | Meetup",
      "description": "Get together with people of color in technology to share your experiences in the industry, learn about new&amp;nbsp;tech, and work towards enriching the local community.&amp;nbsp;See our code of conduct:&amp;nbsp;https://coc.757colorcoded.org/You can also join us on Slack at the 757ColorCoded workspace: http://"
    }
  },
  {
    "name": "Crypto Over Coffee",
    "url": "https://www.meetup.com/crypto-over-coffee/",
    "tags": [
      "Crypto"
    ],
    "category": "Technology",
    "rssFeed": "https://www.meetup.com/crypto-over-coffee/events/rss/",
    "metadata": {
      "imageUrl": "/images/meetups/meetup-com-crypto-over-coffee.jpg",
      "title": "Crypto Over Coffee | Meetup",
      "description": "Hey everyone! This group will meet at local coffee shops around the Virginia Beach, Chesapeake and Norfolk areas. The purpose of this group is to educate each other regarding cryptocurrency and blockchain technology use cases. This is not a crypto &quot;hype group,&quot; rather a community for intellectually-"
    }
  },
  {
    "name": "Hampton Roads .NET User Group",
    "url": "https://www.meetup.com/hampton-roads-net-users-group/",
    "tags": [
      ".NET"
    ],
    "category": "Development",
    "rssFeed": "https://www.meetup.com/hampton-roads-net-users-group/events/rss/",
    "metadata": {
      "imageUrl": "/images/meetups/meetup-com-hampton-roads-net-users-group.jpg",
      "title": "Hampton Roads .NET Users Group | Meetup",
      "description": "Hampton Roads .NET Users Group caters to anyone interested in developing against Microsoft tools and services.  Whether you are a .NET developer, new or old, or deploying code to Microsoft Azure - we are the group for you!We offer meetings on various subjects, and we welcome developers of any skill "
    }
  },
  {
    "name": "Hampton Roads Amazon Web Services User Group",
    "url": "https://www.meetup.com/hampton-roads-amazon-web-services-user-group/",
    "tags": [
      "AWS"
    ],
    "category": "Cloud",
    "rssFeed": "https://www.meetup.com/hampton-roads-amazon-web-services-user-group/events/rss/",
    "metadata": {
      "imageUrl": "/images/meetups/meetup-com-hampton-roads-amazon-web-services-user-group.jpg",
      "title": "Hampton Roads Amazon Web Services User Group | Meetup",
      "description": "EC2 and Lambda and S3 -- oh my!Are you interested in AWS, new to AWS, or an AWS Veteran? Join and help us grow an AWS User Group in Hampton Roads. Meetings are free and open to the public on the first Tuesday of every month at 6 PM.We meet at DOMA Technologies every month. Please check out our event"
    }
  },
  {
    "name": "Hampton Roads Azure Users Group",
    "url": "https://www.meetup.com/hampton-roads-azure-users-group/",
    "tags": [
      "Azure",
      "Cloud"
    ],
    "category": "Cloud",
    "rssFeed": "https://www.meetup.com/hampton-roads-azure-users-group/events/rss/",
    "metadata": {
      "imageUrl": "/images/meetups/meetup-com-hampton-roads-azure-users-group.jpg",
      "title": "Hampton Roads Azure Users Group | Meetup",
      "description": "The Hampton Roads Azure Users Group is a community of technology professionals and enthusiasts interested in Microsoft Azure. The group is based in the Hampton Roads area of Virginia, including Norfolk, Virginia Beach, Chesapeake, Suffolk, Portsmouth, and Hampton.The Hampton Roads Azure Users Group "
    }
  },
  {
    "name": "Hampton Roads Cyber Security for Control Systems",
    "url": "https://www.meetup.com/norfolk-cyber-security-for-control-systems/",
    "tags": [
      "Cyber Security"
    ],
    "category": "Technology",
    "rssFeed": "https://www.meetup.com/norfolk-cyber-security-for-control-systems/events/rss/",
    "metadata": {
      "imageUrl": "/images/meetups/meetup-com-norfolk-cyber-security-for-control-systems.jpg",
      "title": "Hampton Roads Cyber Security for Control Systems | Meetup",
      "description": "Welcome! This meetup dedicated to all professionals involved in Cyber Security for Automated Processes and Control Systems including security for Operating Technology (OT), Industrial Control Systems (ICS), SCADA Systems, Transportation Systems, Building Control Systems (BCS), and even emerging Indu"
    }
  },
  {
    "name": "Hampton Roads Java Users Group",
    "url": "https://www.meetup.com/hampton-roads-java-users-group",
    "tags": [
      "Java",
      "Kotlin",
      "Scala",
      "Clojure"
    ],
    "category": "Development",
    "rssFeed": "https://www.meetup.com/hampton-roads-java-users-group/events/rss/",
    "metadata": {
      "imageUrl": "/images/meetups/meetup-com-hampton-roads-java-users-group.jpg",
      "title": "Hampton Roads Java Users Group | Meetup",
      "description": "This is a group dedicated to the learning, discussion, and usage of the Java Programming language and other JVM based languages like Kotlin, Scala, and Clojure. we also do networking with other developers.Official Discord Server: https://discord.gg/nUSHDN2J2T"
    }
  },
  {
    "name": "Hampton Roads SQL Server User Group",
    "url": "https://www.meetup.com/Hampton-Roads-SQL-Server-User-Group/",
    "tags": [
      "SQL"
    ],
    "category": "Development",
    "rssFeed": "https://www.meetup.com/Hampton-Roads-SQL-Server-User-Group/events/rss/",
    "metadata": {
      "imageUrl": "/images/meetups/meetup-com-hampton-roads-sql-server-user-group.jpg",
      "title": "Hampton Roads SQL Server User Group | Meetup",
      "description": "The HRSSUG is focused on Microsoft SQL Server software and the tools related to its use for all users starting with novices all the way up to experts.[Code of Conduct](https://www.meetup.com/Hampton-Roads-SQL-Server-User-Group/pages/32522408/Anti-Harassment_Policy_Code_of_Conduct/)Join us for HRSSUG"
    }
  },
  {
    "name": "Hampton Roads Unity User Group",
    "url": "https://www.meetup.com/Hampton-Roads-Unity-User-Group/",
    "tags": [
      "Unity",
      "Game Development"
    ],
    "category": "Development",
    "rssFeed": "https://www.meetup.com/Hampton-Roads-Unity-User-Group/events/rss/",
    "metadata": {
      "imageUrl": "/images/meetups/meetup-com-hampton-roads-unity-user-group.jpg",
      "title": "Hampton Roads Unity User Group | Meetup",
      "description": "Unity 3D is a game and software development tool for beginners and experts alike. Our group is focused on individuals seeking more knowledge about the Unity 3D platform, sharing personal experiences as a Unity user, and learning tips and tricks to help streamline productivity. Our meetup is a casual"
    }
  },
  {
    "name": "Information Systems Security Association ISSA Hampton Roads",
    "url": "https://www.meetup.com/issa-hampton-roads/",
    "tags": [
      "Infosec",
      "Security"
    ],
    "category": "Technology",
    "rssFeed": "https://www.meetup.com/issa-hampton-roads/events/rss/",
    "metadata": {
      "imageUrl": "/images/meetups/meetup-com-issa-hampton-roads.jpg",
      "title": "Information Systems Security Association ISSA Hampton Roads | Meetup",